{
  "schema_version": 1,
  "generated_at": "2026-08-22T17:17:17Z",
  "rates": [
    {
      "institution": "bcu",
      "institution_name": "Banco Central del Uruguay",
      "currency": "EUR",
      "buy": "46.940612",
      "sell": "46.940612",
      "rate_type": "official",
      "quoted_at": "2026-08-21",
      "fetched_at": "2026-08-22T17:17:17Z",
      "source_url": "https://cotizaciones.bcu.gub.uy/wscotizaciones/servlet/awsbcucotizaciones"
    },
    {
      "institution": "bcu",
      "institution_name": "Banco Central del Uruguay",
      "currency": "USD",
      "buy": "40.182000",
      "sell": "40.182000",
      "rate_type": "official",
      "quoted_at": "2026-08-21",
      "fetched_at": "2026-08-22T17:17:17Z",
      "source_url": "https://cotizaciones.bcu.gub.uy/wscotizaciones/servlet/awsbcucotizaciones"
    },
    {
      "institution": "brou",
      "institution_name": "Banco de la Republica Oriental del Uruguay",
      "currency": "EUR",
      "buy": "44.59000",
      "sell": "49.62000",
      "rate_type": "cash",
      "quoted_at": "2026-08-22",
      "fetched_at": "2026-08-22T17:17:17Z",
      "source_url": "https://www.brou.com.uy/web/guest/cotizaciones"
    },
    {
      "institution": "brou",
      "institution_name": "Banco de la Republica Oriental del Uruguay",
      "currency": "USD",
      "buy": "38.95000",
      "sell": "41.45000",
      "rate_type": "cash",
      "quoted_at": "2026-08-22",
      "fetched_at": "2026-08-22T17:17:17Z",
      "source_url": "https://www.brou.com.uy/web/guest/cotizaciones"
    },
    {
      "institution": "brou",
      "institution_name": "Banco de la Republica Oriental del Uruguay",
      "currency": "USD",
      "buy": "39.45000",
      "sell": "40.95000",
      "rate_type": "ebanking",
      "quoted_at": "2026-08-22",
      "fetched_at": "2026-08-22T17:17:17Z",
      "source_url": "https://www.brou.com.uy/web/guest/cotizaciones"
    },
    {
      "institution": "itau",
      "institution_name": "Itau Uruguay",
      "currency": "EUR",
      "buy": "44.60",
      "sell": "49.60",
      "rate_type": "cash",
      "quoted_at": "2026-08-22",
      "fetched_at": "2026-08-22T17:17:17Z",
      "source_url": "https://www.itau.com.uy/inst/aci/cotiz.xml"
    },
    {
      "institution": "itau",
      "institution_name": "Itau Uruguay",
      "currency": "USD",
      "buy": "38.80",
      "sell": "41.50",
      "rate_type": "cash",
      "quoted_at": "2026-08-22",
      "fetched_at": "2026-08-22T17:17:17Z",
      "source_url": "https://www.itau.com.uy/inst/aci/cotiz.xml"
    },
    {
      "institution": "matriz",
      "institution_name": "Cambio Matriz",
      "currency": "EUR",
      "buy": "46.00",
      "sell": "50.00",
      "rate_type": "cash",
      "quoted_at": "2026-08-22",
      "fetched_at": "2026-08-22T17:17:17Z",
      "source_url": "https://www.cambiomatriz.com.uy/"
    },
    {
      "institution": "matriz",
      "institution_name": "Cambio Matriz",
      "currency": "USD",
      "buy": "38.95",
      "sell": "41.35",
      "rate_type": "cash",
      "quoted_at": "2026-08-22",
      "fetched_at": "2026-08-22T17:17:17Z",
      "source_url": "https://www.cambiomatriz.com.uy/"
    },
    {
      "institution": "varlix",
      "institution_name": "Varlix",
      "currency": "EUR",
      "buy": "45.20",
      "sell": "49.20",
      "rate_type": "cash",
      "quoted_at": "2026-08-22",
      "fetched_at": "2026-08-22T17:17:17Z",
      "source_url": "https://www.varlix.com.uy/"
    },
    {
      "institution": "varlix",
      "institution_name": "Varlix",
      "currency": "USD",
      "buy": "39.00",
      "sell": "41.50",
      "rate_type": "cash",
      "quoted_at": "2026-08-22",
      "fetched_at": "2026-08-22T17:17:17Z",
      "source_url": "https://www.varlix.com.uy/"
    }
  ],
  "failures": {
    "bbva": "HTTPError: HTTP Error 403: Forbidden",
    "gales": "HTTPError: HTTP Error 502: Bad Gateway"
  }
}
