{
  "schema_version": 1,
  "generated_at": "2026-10-25T18:05:09Z",
  "rates": [
    {
      "institution": "bcu",
      "institution_name": "Banco Central del Uruguay",
      "currency": "EUR",
      "buy": "44.863313",
      "sell": "44.863313",
      "rate_type": "official",
      "quoted_at": "2026-10-23",
      "fetched_at": "2026-10-25T18:05:09Z",
      "source_url": "https://cotizaciones.bcu.gub.uy/wscotizaciones/servlet/awsbcucotizaciones"
    },
    {
      "institution": "bcu",
      "institution_name": "Banco Central del Uruguay",
      "currency": "USD",
      "buy": "40.078000",
      "sell": "40.078000",
      "rate_type": "official",
      "quoted_at": "2026-10-23",
      "fetched_at": "2026-10-25T18:05:09Z",
      "source_url": "https://cotizaciones.bcu.gub.uy/wscotizaciones/servlet/awsbcucotizaciones"
    },
    {
      "institution": "gales",
      "institution_name": "Gales",
      "currency": "EUR",
      "buy": "43.50",
      "sell": "47.50",
      "rate_type": "cash",
      "quoted_at": "2026-10-25",
      "fetched_at": "2026-10-25T18:05:09Z",
      "source_url": "https://www.gales.com.uy/"
    },
    {
      "institution": "gales",
      "institution_name": "Gales",
      "currency": "USD",
      "buy": "38.90",
      "sell": "41.30",
      "rate_type": "cash",
      "quoted_at": "2026-10-25",
      "fetched_at": "2026-10-25T18:05:09Z",
      "source_url": "https://www.gales.com.uy/"
    },
    {
      "institution": "itau",
      "institution_name": "Itau Uruguay",
      "currency": "EUR",
      "buy": "42.50",
      "sell": "47.30",
      "rate_type": "cash",
      "quoted_at": "2026-10-25",
      "fetched_at": "2026-10-25T18:05:09Z",
      "source_url": "https://www.itau.com.uy/inst/aci/cotiz.xml"
    },
    {
      "institution": "itau",
      "institution_name": "Itau Uruguay",
      "currency": "USD",
      "buy": "38.75",
      "sell": "41.35",
      "rate_type": "cash",
      "quoted_at": "2026-10-25",
      "fetched_at": "2026-10-25T18:05:09Z",
      "source_url": "https://www.itau.com.uy/inst/aci/cotiz.xml"
    },
    {
      "institution": "varlix",
      "institution_name": "Varlix",
      "currency": "EUR",
      "buy": "43.50",
      "sell": "47.50",
      "rate_type": "cash",
      "quoted_at": "2026-10-25",
      "fetched_at": "2026-10-25T18:05:09Z",
      "source_url": "https://www.varlix.com.uy/"
    },
    {
      "institution": "varlix",
      "institution_name": "Varlix",
      "currency": "USD",
      "buy": "38.90",
      "sell": "41.40",
      "rate_type": "cash",
      "quoted_at": "2026-10-25",
      "fetched_at": "2026-10-25T18:05:09Z",
      "source_url": "https://www.varlix.com.uy/"
    }
  ],
  "failures": {
    "bbva": "TimeoutError: The read operation timed out",
    "brou": "ValueError: BROU: could not find render token or portlet instance",
    "matriz": "URLError: <urlopen error [Errno -5] No address associated with hostname>"
  }
}
